[
  {
    "eventId": "685286c667510543a64741fdfcbe9bb1863099bc30cf114437b12884159b25f6",
    "eventType": "SecurityMasterRecord",
    "schemaVersion": 1,
    "source": "hallmark-ingest",
    "key": "INE053F08403",
    "businessDate": "2026-10-15",
    "producedAt": "2026-10-15T14:02:44.760323+00:00",
    "payload": {
      "isin": "INE053F08403",
      "source": "NSDL",
      "snapshotDate": "2026-10-15",
      "description": "INDIAN RAILWAY FINANCE CORPORATION LIMITED SR 180 7.39 BD 15JL34 FVRS1LAC",
      "issuerName": "INDIAN RAILWAY FINANCE CORPORATION LIMITED",
      "cin": "U65910DL1986GOI026363",
      "lei": "335800F2JHSOGXQEBY56",
      "ownership": "PSU",
      "issuerNature": "NBFC",
      "sector": "Financial Services",
      "industry": "Finance",
      "basicIndustry": "Non-Banking Financial Company (NBFC)",
      "instrumentType": "Bonds",
      "couponRate": 7.39,
      "couponBasis": "Fixed Interest",
      "paymentFrequency": "Once a year",
      "dayCount": "Actual/actual",
      "maturityDate": "2034-07-15",
      "issueDate": null,
      "faceValue": 100000.0,
      "listingStatus": null,
      "stepUp": false,
      "stepUpTerms": null,
      "scheduleWarnings": [],
      "firstCallDate": null,
      "firstPutDate": null,
      "ratings": [
        {
          "agency": "CRISIL",
          "rawRating": "AAA",
          "symbol": "AAA",
          "scale": "LONG",
          "notch": 1,
          "outlook": "Stable",
          "action": "New",
          "ratingDate": "2024-05-31",
          "changeDate": null,
          "watch": "No Watch",
          "isCurrent": true,
          "creditEnhanced": false,
          "structured": false,
          "provisional": false,
          "withdrawn": false
        },
        {
          "agency": "ICRA",
          "rawRating": "AAA",
          "symbol": "AAA",
          "scale": "LONG",
          "notch": 1,
          "outlook": "Stable",
          "action": "Reaffirm",
          "ratingDate": "2026-03-31",
          "changeDate": "2026-03-31",
          "watch": "No Watch",
          "isCurrent": true,
          "creditEnhanced": false,
          "structured": false,
          "provisional": false,
          "withdrawn": false
        },
        {
          "agency": "CARE",
          "rawRating": "AAA",
          "symbol": "AAA",
          "scale": "LONG",
          "notch": 1,
          "outlook": "Stable",
          "action": "Reaffirm",
          "ratingDate": "2024-06-05",
          "changeDate": "2026-07-09",
          "watch": "No Watch",
          "isCurrent": true,
          "creditEnhanced": false,
          "structured": false,
          "provisional": false,
          "withdrawn": false
        },
        {
          "agency": "CARE",
          "rawRating": "AAA",
          "symbol": "AAA",
          "scale": "LONG",
          "notch": 1,
          "outlook": "Stable",
          "action": "New",
          "ratingDate": "2024-07-03",
          "changeDate": null,
          "watch": "No Watch",
          "isCurrent": false,
          "creditEnhanced": false,
          "structured": false,
          "provisional": false,
          "withdrawn": false
        },
        {
          "agency": "CARE",
          "rawRating": "AAA",
          "symbol": "AAA",
          "scale": "LONG",
          "notch": 1,
          "outlook": "Stable",
          "action": "Reaffirm",
          "ratingDate": "2024-06-05",
          "changeDate": "2026-04-14",
          "watch": "No Watch",
          "isCurrent": false,
          "creditEnhanced": false,
          "structured": false,
          "provisional": false,
          "withdrawn": false
        },
        {
          "agency": "CARE",
          "rawRating": "AAA",
          "symbol": "AAA",
          "scale": "LONG",
          "notch": 1,
          "outlook": "Stable",
          "action": "Reaffirm",
          "ratingDate": "2024-06-05",
          "changeDate": "2025-07-08",
          "watch": "No Watch",
          "isCurrent": false,
          "creditEnhanced": false,
          "structured": false,
          "provisional": false,
          "withdrawn": false
        },
        {
          "agency": "CARE",
          "rawRating": "AAA",
          "symbol": "AAA",
          "scale": "LONG",
          "notch": 1,
          "outlook": "Stable",
          "action": "Reaffirm",
          "ratingDate": "2024-06-05",
          "changeDate": "2025-05-13",
          "watch": "No Watch",
          "isCurrent": false,
          "creditEnhanced": false,
          "structured": false,
          "provisional": false,
          "withdrawn": false
        },
        {
          "agency": "ICRA",
          "rawRating": "AAA",
          "symbol": "AAA",
          "scale": "LONG",
          "notch": 1,
          "outlook": "Stable",
          "action": "New",
          "ratingDate": "2024-06-07",
          "changeDate": null,
          "watch": null,
          "isCurrent": false,
          "creditEnhanced": false,
          "structured": false,
          "provisional": false,
          "withdrawn": false
        },
        {
          "agency": "ICRA",
          "rawRating": "AAA",
          "symbol": "AAA",
          "scale": "LONG",
          "notch": 1,
          "outlook": "Stable",
          "action": "Reaffirm",
          "ratingDate": "2025-05-15",
          "changeDate": "2025-05-15",
          "watch": "No Watch",
          "isCurrent": false,
          "creditEnhanced": false,
          "structured": false,
          "provisional": false,
          "withdrawn": false
        }
      ],
      "cashflows": [
        {
          "paymentDate": "2025-04-15",
          "dueDate": "2025-04-15",
          "amountPerUnit": 5547.56,
          "principal": false,
          "event": "Interest"
        },
        {
          "paymentDate": "2026-04-15",
          "dueDate": "2026-04-15",
          "amountPerUnit": 7390.0,
          "principal": false,
          "event": "Interest"
        },
        {
          "paymentDate": "2027-04-15",
          "dueDate": "2027-04-15",
          "amountPerUnit": 7390.0,
          "principal": false,
          "event": "Interest"
        },
        {
          "paymentDate": "2028-04-15",
          "dueDate": "2028-04-15",
          "amountPerUnit": 7390.0,
          "principal": false,
          "event": "Interest"
        },
        {
          "paymentDate": "2029-04-16",
          "dueDate": "2029-04-15",
          "amountPerUnit": 7390.0,
          "principal": false,
          "event": "Interest"
        },
        {
          "paymentDate": "2030-04-15",
          "dueDate": "2030-04-15",
          "amountPerUnit": 7390.0,
          "principal": false,
          "event": "Interest"
        },
        {
          "paymentDate": "2031-04-15",
          "dueDate": "2031-04-15",
          "amountPerUnit": 7390.0,
          "principal": false,
          "event": "Interest"
        },
        {
          "paymentDate": "2032-04-15",
          "dueDate": "2032-04-15",
          "amountPerUnit": 7390.0,
          "principal": false,
          "event": "Interest"
        },
        {
          "paymentDate": "2033-04-15",
          "dueDate": "2033-04-15",
          "amountPerUnit": 7390.0,
          "principal": false,
          "event": "Interest"
        },
        {
          "paymentDate": "2034-04-15",
          "dueDate": "2034-04-15",
          "amountPerUnit": 7390.0,
          "principal": false,
          "event": "Interest"
        },
        {
          "paymentDate": "2034-07-15",
          "dueDate": "2034-07-15",
          "amountPerUnit": 100000.0,
          "principal": true,
          "event": "Full Redemption"
        },
        {
          "paymentDate": "2034-07-15",
          "dueDate": "2034-07-15",
          "amountPerUnit": 1842.44,
          "principal": false,
          "event": "Interest"
        }
      ]
    }
  },
  {
    "eventId": "dac7340c7879b26849147328deab996367561a74349a18cf4f5a1904c596f3ca",
    "eventType": "SecurityMasterRecord",
    "schemaVersion": 1,
    "source": "hallmark-ingest",
    "key": "INE296A07UB9",
    "businessDate": "2026-10-15",
    "producedAt": "2026-10-15T14:02:44.768500+00:00",
    "payload": {
      "isin": "INE296A07UB9",
      "source": "NSDL",
      "snapshotDate": "2026-10-15",
      "description": "BAJAJ FINANCE LIMITED 7.70 NCD 20SP29 FVRS1LAC",
      "issuerName": "BAJAJ FINANCE LIMITED",
      "cin": "L65910MH1987PLC042961",
      "lei": "335800YTEXC3DO4Z6F68",
      "ownership": "PRIVATE",
      "issuerNature": "NBFC",
      "sector": "Financial Services",
      "industry": "Finance",
      "basicIndustry": "Non-Banking Financial Company (NBFC)",
      "instrumentType": "Debentures",
      "couponRate": 7.7,
      "couponBasis": "Fixed Interest",
      "paymentFrequency": "Once a year",
      "dayCount": "Actual/actual",
      "maturityDate": "2029-09-20",
      "issueDate": null,
      "faceValue": 100000.0,
      "listingStatus": null,
      "stepUp": false,
      "stepUpTerms": null,
      "scheduleWarnings": [],
      "firstCallDate": null,
      "firstPutDate": null,
      "ratings": [
        {
          "agency": "CRISIL",
          "rawRating": "AAA",
          "symbol": "AAA",
          "scale": "LONG",
          "notch": 1,
          "outlook": "Stable",
          "action": "New",
          "ratingDate": "2026-04-28",
          "changeDate": null,
          "watch": "No Watch",
          "isCurrent": true,
          "creditEnhanced": false,
          "structured": false,
          "provisional": false,
          "withdrawn": false
        }
      ],
      "cashflows": [
        {
          "paymentDate": "2027-09-20",
          "dueDate": "2027-09-20",
          "amountPerUnit": 9303.29,
          "principal": false,
          "event": "Interest"
        },
        {
          "paymentDate": "2028-09-20",
          "dueDate": "2028-09-20",
          "amountPerUnit": 7700.0,
          "principal": false,